study_id,bibliography_id,publication_type,bibtype,title,doi,author,journal,volume,number,year,institution,school,url,keywords,publisher,copyright
Poppe_and_Rybczyk_2018,Poppe_and_Rybczyk_2018_article,synthesis source,Article,Carbon Sequestration in a Pacific Northwest Eelgrass (Zostera marina) Meadow,10.3955/046.092.0202,KL Poppe and JM Rybczyk,Northwest Science,92,2,2018,NA,NA,NA,NA,NA,NA
Poppe_and_Rybczyk_2018,Poppe_and_Rybczyk_2018_mastersthesis,synthesis source,MastersThesis,An Ecogeomorphic Model to Assess the Response of Padilla Bay's Eelgrass Habitat to Sea Level Rise,NA,KL Poppe,NA,NA,NA,2015,NA,Western Washington University,NA,NA,NA,NA
Poppe_and_Rybczyk_2018,Poppe_et_al_2019_synthesis,synthesis dataset,Misc,"Dataset: Sediment carbon stocks and sequestration rates in the Pacific Northwest region of Washington, USA",10.25573/DATA.10005248,Katrina L Poppe and John M Rybczyk,NA,NA,NA,2019,NA,NA,https://smithsonian.figshare.com/articles/Dataset_Sediment_carbon_stocks_and_sequestration_rates_in_the_Pacific_Northwest_region_of_Washington_USA/10005248,"Soil Science, 50301 Carbon Sequestration Science, FOS: Agriculture, forestry and fisheries",The Smithsonian Institution,CC BY 4.0
Poppe_and_Rybczyk_2019,Poppe_and_Rybczyk_2019_techreport,synthesis source,TechReport,A Blue Carbon Assessment for the Stillaguamish River Estuary: Quantifying the Climate Benefits of Tidal Marsh Restoration,NA,KL Poppe and JM Rybczyk,NA,NA,NA,2019,Western Washington University,NA,NA,NA,NA,NA
Poppe_and_Rybczyk_2019,Poppe_et_al_2019_synthesis,synthesis dataset,Misc,"Dataset: Sediment carbon stocks and sequestration rates in the Pacific Northwest region of Washington, USA",10.25573/DATA.10005248,Katrina L Poppe and John M Rybczyk,NA,NA,NA,2019,NA,NA,https://smithsonian.figshare.com/articles/Dataset_Sediment_carbon_stocks_and_sequestration_rates_in_the_Pacific_Northwest_region_of_Washington_USA/10005248,"Soil Science, 50301 Carbon Sequestration Science, FOS: Agriculture, forestry and fisheries",The Smithsonian Institution,CC BY 4.0
Poppe_et_al_2019,Poppe_et_al_2019_techreport,synthesis source,TechReport,Coastal Blue Carbon Opportunity Assessment for the Snohomish Estuary: The Climate Benefits of Estuary Restoration,NA,S Crooks and J Rybczyk and K O`Connell and D L Devier and K Poppe and S Emmett-Mattox,NA,NA,NA,2014,Western Washington University,NA,NA,NA,NA,NA
Poppe_et_al_2019,Poppe_et_al_2019_synthesis,synthesis dataset,Misc,"Dataset: Sediment carbon stocks and sequestration rates in the Pacific Northwest region of Washington, USA",10.25573/DATA.10005248,Katrina L Poppe and John M Rybczyk,NA,NA,NA,2019,NA,NA,https://smithsonian.figshare.com/articles/Dataset_Sediment_carbon_stocks_and_sequestration_rates_in_the_Pacific_Northwest_region_of_Washington_USA/10005248,"Soil Science, 50301 Carbon Sequestration Science, FOS: Agriculture, forestry and fisheries",The Smithsonian Institution,CC BY 4.0
